{
  "schema_version": "2.0",
  "praxa_version": "0.6.1",
  "scan": {
    "agent": "yaah (Yet Another Agent Harness)",
    "agent_slug": "yaah",
    "scan_date": "2026-05-12",
    "scan_timestamp": "2026-05-12T21:36:18Z",
    "workspace": "/tmp/yaah",
    "artifact_count": 26
  },
  "intro_band": {
    "agent_remit_summary": "A coding-agent configuration harness (the <code>yaah</code> Go CLI). It generates configuration for four coding agents — Claude Code, OpenCode, Codex CLI, GitHub Copilot CLI — from one codebase, and ships a built-in security/quality toolset wired into the agent: five hooks (a linter, a command guard that blocks <code>rm -rf /</code> and similar, a secret scanner, a comment checker, a session logger), a session audit log of every tool call and blocked action, and a built-in MCP server (<code>yaah serve</code>) exposing <code>yaah_scan_secrets</code> / <code>yaah_lint</code> / <code>yaah_check_command</code> / <code>yaah_doctor</code> / planning tools, alongside the third-party <code>context7</code> and <code>pulumi</code> MCP servers it configures. The generated configs are expected to carry the same protections across all four target agents, and the harness is expected to keep credentials out of edited files (the secret scanner) and catastrophic shell commands out of the agent's reach (the command guard).",
    "agent_structure_summary": "A Go 1.25 module — <code>cmd/yaah</code> is the cobra CLI; <code>pkg/harness</code> wires the registries; <code>pkg/hooks/handlers/</code> holds the built-in handlers (<code>guard.go</code> command-guard, <code>secretscan.go</code> ~13-pattern secret scanner, <code>linter.go</code>, <code>commentcheck.go</code>, <code>sessionlog.go</code>); <code>pkg/mcpserver/</code> is the built-in MCP server (<code>server.go</code> over stdio via <code>modelcontextprotocol/go-sdk</code>, <code>tools.go</code> registering the seven <code>yaah_*</code> tools); <code>pkg/mcp/providers/</code> defines the configured MCP providers (yaah, context7, pulumi); <code>pkg/session/store.go</code> is the file-based session audit log; <code>pkg/generator/</code> has the per-agent config generators (<code>claude.go</code>, <code>opencode.go</code>, <code>codex.go</code>, <code>copilot.go</code>) plus <code>hookmap.go</code>, which maps Claude hook events to each agent's equivalent — and leaves <code>PreToolUse</code> / <code>PostToolUse</code> blank for Codex. The repo's <code>.mcp.json</code> (and a duplicated block in <code>.claude/settings.json</code>) declares three MCP servers: <code>context7</code> (stdio, <code>npx -y @context7/mcp</code>), <code>pulumi</code> (http, <code>https://mcp.ai.pulumi.com/mcp</code>), <code>yaah</code> (stdio, <code>yaah serve</code>). <code>AGENTS.md</code> (with <code>CLAUDE.md</code> / <code>GEMINI.md</code> as symlinks) is an agent-managed file with <code><!-- AGENTS-GENERATED --></code> sections. <code>go.mod</code> pins exact versions; <code>go.sum</code> carries module hashes; there is no <code>SECURITY.md</code>."
  },
  "behavior_summary": "<p>The dominant pattern here is the inverse of the usual one: <strong>a security-conscious harness whose own controls are real and operative — but unevenly delivered.</strong> <code>yaah</code> ships a deterministic command-guard hook (it actually blocks <code>rm -rf /</code>, force-push to main, <code>DROP TABLE</code>, <code>mkfs</code>, raw disk writes on every Bash call), a 13-pattern secret scanner on every file edit, a structured session audit log, and a built-in MCP server whose tool descriptions are clean — that's a coherent safety model, and it scores accordingly. The headline gap is consistency: <code>pkg/generator/hookmap.go</code> leaves <code>PreToolUse</code> / <code>PostToolUse</code> blank for the Codex CLI target, so <code>yaah generate --agent codex</code> produces a config with none of the \"5 hooks out of the box\" the README advertises — no command guard, no post-edit secret scan (PRAX-2026-05-12-001).</p><p>On the MCP surface: the built-in <code>yaah</code> server is clean and <code>pulumi</code> is TLS; the structural gaps are the usual ones plus one specific to this config — <code>context7</code> is launched via <code>npx -y @context7/mcp</code> with no version pin (a silent-update vector), MCP tool calls aren't covered by the PreToolUse/PostToolUse hooks so they fall outside the session log, and tool descriptions/outputs from all three servers reach the model unfiltered.</p>",
  "remit_coverage": {
    "stat_counts": {
      "verified": 4,
      "gap": 4,
      "partial": 5,
      "vague": 0,
      "enp": 0,
      "total": 13
    },
    "rules": [
      {
        "rule_id": "R-01",
        "section": "Mission",
        "rule_text": "Generate coding-agent configuration for Claude Code, OpenCode, Codex CLI, and GitHub Copilot CLI from one codebase, and ship a built-in security/quality toolset (hooks, an MCP server, a session audit log).",
        "status": "verified",
        "finding_id": null
      },
      {
        "rule_id": "R-02",
        "section": "Stated Protections",
        "rule_text": "Every generated agent config carries the same five hooks — linter, command guard (blocks rm -rf / and similar), secret scanner, comment checker, session logger.",
        "status": "gap",
        "finding_id": "PRAX-2026-05-12-001"
      },
      {
        "rule_id": "R-03",
        "section": "Action Boundaries",
        "rule_text": "Catastrophic shell commands (recursive delete from root, force-push to main, hard reset, destructive SQL, filesystem format, raw disk write) MUST be blocked before execution.",
        "status": "verified",
        "finding_id": null
      },
      {
        "rule_id": "R-04",
        "section": "Forbidden Actions",
        "rule_text": "Hardcoded credentials in edited files MUST be detected.",
        "status": "partial",
        "finding_id": "PRAX-2026-05-12-006"
      },
      {
        "rule_id": "R-05",
        "section": "Action Boundaries",
        "rule_text": "Remote MCP servers MUST be reached over TLS.",
        "status": "verified",
        "finding_id": null
      },
      {
        "rule_id": "R-06",
        "section": "Known Good Baseline",
        "rule_text": "Configured MCP servers MUST be pinned / from a known-good source with an integrity check.",
        "status": "gap",
        "finding_id": "PRAX-2026-05-12-002"
      },
      {
        "rule_id": "R-07",
        "section": "Approval Requirements",
        "rule_text": "High-impact actions — destructive shell commands, file writes, MCP tools that write/send/execute — should be reviewed before execution.",
        "status": "partial",
        "finding_id": "PRAX-2026-05-12-004"
      },
      {
        "rule_id": "R-08",
        "section": "Behavioral Expectations",
        "rule_text": "The harness should maintain a durable, structured record of tool calls, blocked actions, and file modifications.",
        "status": "partial",
        "finding_id": "PRAX-2026-05-12-004"
      },
      {
        "rule_id": "R-09",
        "section": "Forbidden Actions",
        "rule_text": "Agent-managed / session-loaded files (AGENTS.md and its symlinks) should not be writable in a way that lets ingested content persist into future sessions without review.",
        "status": "gap",
        "finding_id": "PRAX-2026-05-12-005"
      },
      {
        "rule_id": "R-10",
        "section": "Action Boundaries",
        "rule_text": "MCP tool descriptions MUST NOT contain instruction-like language directed at the model.",
        "status": "partial",
        "finding_id": "PRAX-2026-05-12-003"
      },
      {
        "rule_id": "R-11",
        "section": "Known Good Baseline",
        "rule_text": "Dependencies MUST be version-controlled with a committed lockfile and pinned.",
        "status": "verified",
        "finding_id": null
      },
      {
        "rule_id": "R-12",
        "section": "Behavioral Expectations",
        "rule_text": "The .mcp.json and the per-agent config files generated by yaah should not drift apart.",
        "status": "partial",
        "finding_id": "PRAX-2026-05-12-007"
      },
      {
        "rule_id": "R-13",
        "section": "Escalation and Limits",
        "rule_text": "The project should publish a threat model / SECURITY.md and run adversarial testing of its own protections.",
        "status": "gap",
        "finding_id": "PRAX-2026-05-12-008"
      }
    ]
  },
  "findings": [
    {
      "id": "PRAX-2026-05-12-001",
      "severity": "High",
      "summary": "yaah's deterministic protection hooks (command guard, secret scanner, comment checker, linter) are not delivered to the Codex CLI–generated config — hookmap.go leaves PreToolUse/PostToolUse blank for Codex.",
      "description": "The README sells \"5 hooks out of the box: linting…, a command guard that blocks rm -rf / and friends, a secret scanner…\". But <code>hookMappings</code> in <code>pkg/generator/hookmap.go</code> maps <code>HookPreToolUse</code> and <code>HookPostToolUse</code> to event names for Claude (<code>PreToolUse</code>/<code>PostToolUse</code>), OpenCode (<code>tool.execute.before</code>/<code>after</code>), and Copilot (<code>preToolUse</code>/<code>postToolUse</code>) — but to nothing for Codex. So <code>yaah generate --agent codex</code> produces a config in which the command guard never runs (no <code>rm -rf /</code> block) and the secret scanner never runs on edits. A user trusting the harness's stated protections on Codex CLI doesn't have them.",
      "tags": [
        {
          "kind": "raise",
          "label": "Implement Zero Trust"
        }
      ],
      "policy_rule_ids": "R-02",
      "policy_rule_text": "Every generated agent config carries the same five hooks — linter, command guard (blocks rm -rf / and similar), secret scanner, comment checker, session logger.",
      "evidence": [
        {
          "file": "pkg/generator/hookmap.go",
          "line": 30,